{"type":"config","name":"Optimize Sam-C Support Assistant prompt","metricName":"overall_score","metricUnit":"","bestDirection":"higher"}
{"run":1,"commit":"82a6097","metric":0.7867,"metrics":{"task_success":0.78,"tone":0.78,"safety":0.8},"status":"keep","description":"Baseline prompt for Sam-C Support Assistant with empathy, clarity, and careful policy adherence","timestamp":1780453848588,"segment":0,"confidence":null,"asi":{"hypothesis":"Baseline prompt for triage assistant with cautious, empathetic, clear, and safe reply pattern"}}
{"run":2,"commit":"9b64620","metric":0.8467,"metrics":{"task_success":0.82,"tone":0.82,"safety":0.9},"status":"keep","description":"Improved prompt with precise, stepwise response pattern and stronger warnings against guarantees and overpromising","timestamp":1780453908378,"segment":0,"confidence":null,"asi":{"hypothesis":"Adding explicit 4-step response pattern, stronger warnings on guarantees"}}
{"run":3,"commit":"385aee4","metric":0.8533,"metrics":{"task_success":0.82,"tone":0.84,"safety":0.9},"status":"keep","description":"Added warning against giving legal advice to improve clarity and safety","timestamp":1780453957763,"segment":0,"confidence":10.090909090909182,"asi":{"hypothesis":"Adding explicit warning to avoid legal advice in responses"}}
{"run":4,"commit":"head","metric":0.8467,"metrics":{"task_success":0.82,"tone":0.82,"safety":0.9},"status":"discard","description":"Added instruction to prioritize clear, conflict-free language and calm professional tone but saw regression in tone and no overal improvement","timestamp":1780454005609,"segment":0,"confidence":20.181818181818365,"asi":{"hypothesis":"Add instruction for clear conflict-free language and calm professional tone","rollback_reason":"Tone metric regressed and overall score did not improve","next_action_hint":"Try different wording or another hypothesis"}}
{"run":5,"commit":"head","metric":0.8,"metrics":{"task_success":0.74,"tone":0.78,"safety":0.88},"status":"discard","description":"Added explicit mention to avoid guarantees or promises regarding refunds, data recovery, account changes or policy exceptions. Resulted in regression across metrics, so reverted.","timestamp":1780454076447,"segment":0,"confidence":10.090909090909182,"asi":{"hypothesis":"Explicitly mention avoiding guarantees and promises regarding refunds, data recovery, account changes, or policy exceptions","rollback_reason":"Metrics regressed after this change","next_action_hint":"Try softer wording or rephrase to avoid harshness"}}
{"run":6,"commit":"754fef4","metric":0.8533,"metrics":{"task_success":0.82,"tone":0.82,"safety":0.92},"status":"keep","description":"Softened caution about guarantees/promises to avoid harshness, improved safety metric","timestamp":1780454123325,"segment":0,"confidence":10.090909090909182,"asi":{"hypothesis":"Use softer wording to caution against guarantees and promises to improve clarity and tone"}}
{"run":7,"commit":"head","metric":0.8333,"metrics":{"task_success":0.78,"tone":0.84,"safety":0.88},"status":"discard","description":"Added emphasis on extra care and escalation for billing, data loss, login, cancellation. Regression in safety and task success, so discarded.","timestamp":1780454179705,"segment":0,"confidence":10.090909090909182,"asi":{"hypothesis":"Emphasize extra care and escalation specifically for billing, data loss, login, cancellation issues","rollback_reason":"Safety and task success metrics regressed","next_action_hint":"Try softer or more general caution, or try other hypotheses"}}
{"run":8,"commit":"head","metric":0.84,"metrics":{"task_success":0.82,"tone":0.82,"safety":0.88},"status":"discard","description":"Removed explicit callout of billing, data loss, login, cancellation to evaluate impact. Slight decrease in safety metric, no overall improvement, so discarded.","timestamp":1780454260921,"segment":0,"confidence":6.693467336683481,"asi":{"hypothesis":"Remove explicit special attention to billing, data loss, login, cancellation issues","rollback_reason":"Slight decrease in safety and no overall improvement","next_action_hint":"Consider alternative wording or alternative hypotheses"}}
{"type":"config","name":"Optimize Sam-C prompt for higher overall_score with conciseness evaluator","metricName":"overall_score","metricUnit":"","bestDirection":"higher"}
{"run":9,"commit":"824e038","metric":0.85,"metrics":{"task_success":0.98,"tone":0.98,"safety":1,"conciseness":0.44},"status":"keep","description":"Baseline under the new benchmark that adds conciseness to overall_score using the existing four-step prompt","timestamp":1780459426335,"segment":1,"confidence":null,"asi":{"hypothesis":"Re-baseline the current best historical prompt after adding conciseness as a fourth judge dimension","observation":"Current prompt is extremely strong on task_success, tone, and safety but conciseness is the clear bottleneck.","next_action_hint":"Keep the safe four-step structure, but make it shorter and clarify that follow-up questions/escalation/expectations are only included when needed."}}
{"run":10,"commit":"head","metric":0.84,"metrics":{"task_success":0.9,"tone":0.92,"safety":0.94,"conciseness":0.6},"status":"discard","description":"Shortened the prompt and made follow-up questions and expectations optional to target conciseness, but the loss in task_success and safety outweighed the conciseness gain","timestamp":1780459501616,"segment":1,"confidence":null,"asi":{"hypothesis":"A shorter prompt that explicitly says to default to the shortest useful reply will raise conciseness without damaging the core behavior.","observation":"Conciseness rose sharply from 0.44 to 0.60, but removing the exact structured pattern weakened coverage and reduced task_success/safety.","rollback_reason":"Primary metric fell from 0.85 to 0.84 despite better conciseness.","next_action_hint":"Keep the strong four-step scaffold, but try compressing wording inside the scaffold rather than relaxing it."}}
{"run":11,"commit":"head","metric":0.835,"metrics":{"task_success":0.9,"tone":0.9,"safety":0.98,"conciseness":0.56},"status":"discard","description":"Kept the four-step scaffold but compressed the wording and told the model to keep each part lean; conciseness improved, but task coverage and tone still dropped enough to hurt overall_score","timestamp":1780459573943,"segment":1,"confidence":null,"asi":{"hypothesis":"A terser four-step prompt can preserve structure while improving conciseness.","observation":"Even with the scaffold preserved, stronger brevity instructions reduced task_success and tone; safety held up better than the previous attempt.","rollback_reason":"Primary metric fell to 0.835 from the 0.85 baseline.","next_action_hint":"Try small surgical edits on the baseline prompt instead of broad conciseness framing; perhaps trim one phrase or refine only the acknowledgment behavior."}}
{"run":12,"commit":"fe3f23d","metric":0.855,"metrics":{"task_success":0.88,"tone":0.9,"safety":0.98,"conciseness":0.66},"status":"keep","description":"Added tight length guidance while preserving the exact four-step scaffold, which materially improved conciseness with only modest drops in the other dimensions","timestamp":1780459713436,"segment":1,"confidence":0.6666666666666666,"asi":{"hypothesis":"Keep the strong baseline structure but constrain each section to be brief and limited to the minimum helpful details.","observation":"This preserved high safety while lifting conciseness sharply from 0.44 to 0.66; task_success and tone dipped, but not enough to outweigh the gain.","next_action_hint":"Build on this prompt carefully. Small topic-specific hints or ordering tweaks may recover task_success without giving up the new brevity win."}}
{"run":13,"commit":"head","metric":0.85,"metrics":{"task_success":0.9,"tone":0.9,"safety":0.96,"conciseness":0.64},"status":"discard","description":"Re-ran the current kept prompt to measure noise; the result fell back to baseline overall_score, confirming that the prior improvement is real enough to keep provisionally but noisy","timestamp":1780459776400,"segment":1,"confidence":1,"asi":{"hypothesis":"Repeat the current best prompt to estimate variance after a low-confidence improvement.","observation":"The same prompt scored 0.855 then 0.85, with conciseness staying much higher than the original baseline but safety/task_success moving around.","rollback_reason":"No new code change was being tested; this run was measurement only and did not beat the kept best.","next_action_hint":"Prefer small, high-signal tweaks from the current concise scaffold and treat sub-0.01 changes as likely noise unless repeated."}}
{"run":14,"commit":"head","metric":0.835,"metrics":{"task_success":0.9,"tone":0.88,"safety":0.94,"conciseness":0.62},"status":"discard","description":"Replaced the generic topic warning with explicit billing and cancellation instructions, but the extra prescriptive detail hurt tone and safety more than it helped task coverage","timestamp":1780459870593,"segment":1,"confidence":0.6666666666666666,"asi":{"hypothesis":"A small amount of targeted guidance for billing and cancellation could recover task_success while keeping the concise scaffold.","observation":"Specific topical instructions appear to make the assistant sound more rigid and less safe, even though conciseness remained better than the original baseline.","rollback_reason":"Primary metric dropped from the kept prompt's 0.855 to 0.835.","next_action_hint":"Keep the concise scaffold and avoid adding topic-specific rules unless they are extremely lightweight."}}
{"run":15,"commit":"head","metric":0,"metrics":{"task_success":0,"tone":0,"safety":0,"conciseness":0},"status":"crash","description":"Tried a very small tone-preserving edit that discouraged bullets except for actual step lists, but the benchmark process crashed before returning metrics","timestamp":1780459908075,"segment":1,"confidence":0.6666666666666666,"asi":{"hypothesis":"Keeping the concise scaffold while preferring sentences over bullets might improve tone without sacrificing brevity.","observation":"The run failed with Windows exit code 3221225786 and no useful benchmark output; likely an environment/tooling crash rather than a prompt-quality signal.","error_code":3221225786,"rollback_reason":"Benchmark crashed, so the result is unusable.","next_action_hint":"Re-try the same small edit once to see whether this was transient; if it crashes again, move on and keep the current best prompt."}}
{"run":16,"commit":"head","metric":0.8,"metrics":{"task_success":0.8,"tone":0.84,"safety":0.9,"conciseness":0.66},"status":"discard","description":"Retried the sentence-first brevity tweak after the transient crash; it ran successfully but clearly degraded task_success, tone, and safety despite keeping conciseness high","timestamp":1780459966742,"segment":1,"confidence":0.5,"asi":{"hypothesis":"Preferring short sentences over bullets may make the concise scaffold sound more natural and improve tone.","observation":"This tweak kept conciseness at the improved level but significantly weakened substantive coverage and safety; the earlier crash was transient, but the idea itself is bad.","rollback_reason":"Primary metric dropped sharply to 0.80.","next_action_hint":"Keep the current best concise scaffold unchanged. Future gains likely require better per-item output control or benchmark insight, not more generic brevity wording."}}
